{
  "schema_version": 1,
  "manifest_revision": 12,
  "project_id": "life",
  "runtime_control_authority": "NONE",
  "updated_at": "2026-09-12T08:51:42Z",
  "objective": "Build Life from first principles as a durable personal AI system whose context retrieval, runtime control, external effects, and engineering process are explicit, verifiable, recoverable across threads, and free of authority derived from prose or model judgment.",
  "phase": "IMPLEMENTATION",
  "current_component": "build_repository_watchdog",
  "current_status": "ACTIVE",
  "authorized_targets": {
    "github": {
      "repository_id": 1366835183,
      "full_name": "Vinanonymous/Build",
      "visibility": "public",
      "default_branch": "main"
    },
    "supabase": {
      "project_id": "jnenguxodtgwbskhdsxt",
      "name": "Life",
      "region": "us-west-2"
    },
    "vercel": null
  },
  "current_work": {
    "goal": "Integrate the permanent self-auditing Build Repository Watchdog against the current parallel-work coordination contract, verify it through protected CI, and create the exact hourly ChatGPT Scheduled task only after every versioned pre-install gate passes.",
    "completion_conditions": [
      "WATCHDOG_SPEC_VERSIONED_ON_MAIN",
      "WATCHDOG_FINDING_REGISTRY_VERSIONED_ON_MAIN",
      "WATCHDOG_VALIDATOR_AND_FALSIFICATION_TESTS_PASS_PROTECTED_CI",
      "WATCHDOG_SELF_AUDIT_COMPATIBILITY_MATCHES_CURRENT_CANONICAL_CONTRACTS",
      "WATCHDOG_ISSUE_MUTATION_POLICY_IS_EXACTLY_VERSIONED_OR_REMAINS_DISABLED",
      "WATCHDOG_SCHEDULED_TASK_CREATED_HOURLY_AMERICA_DENVER",
      "WATCHDOG_SCHEDULED_TASK_READBACK_VERIFIED"
    ]
  },
  "active_decision_ids": [
    "D-0001",
    "D-0002",
    "D-0003",
    "D-0004",
    "D-0005",
    "D-0006",
    "D-0008",
    "D-0009",
    "D-0010",
    "D-0012",
    "D-0013",
    "D-0014",
    "D-0015",
    "D-0016"
  ],
  "retired_decision_ids": [
    "D-0101",
    "D-0102",
    "D-0103"
  ],
  "open_questions": [
    {
      "id": "Q-0001",
      "state": "RESOLVED",
      "question": "Which permanent runtime host should expose the canonical Life MCP endpoint after fresh clean-slate comparison: Supabase Edge Functions, Vercel Functions, or another authorized mechanism?",
      "resolution_decision_id": "D-0015"
    },
    {
      "id": "Q-0002",
      "state": "OPEN",
      "question": "Which exact deterministic runtime control implementation should satisfy CONTROL AUTHORITY for the ten enumerated decision kinds?",
      "resolution_decision_id": null
    },
    {
      "id": "Q-0003",
      "state": "RESOLVED",
      "question": "Which parts of the legacy invocation implementation should be rebuilt, modified, or discarded after clean-slate reevaluation?",
      "resolution_decision_id": "D-0015"
    }
  ],
  "blockers": [
    {
      "id": "B-0001",
      "state": "RESOLVED",
      "condition": "Project Instructions do not yet require future threads to read and validate the continuity bundle.",
      "clears_when": "VINCE_INSTALLS_CONTINUITY_PROJECT_INSTRUCTION"
    },
    {
      "id": "B-0002",
      "state": "RESOLVED",
      "condition": "The connected GitHub tool exposes repository-ruleset reads but no repository-ruleset write operation, and metered browser automation is not authorized.",
      "clears_when": "ONE_OF:GITHUB_RULESET_WRITE_ACTION_AVAILABLE|VINCE_MANUALLY_CREATES_EXACT_RULESET|VINCE_AUTHORIZES_METERED_BROWSER_AUTOMATION"
    },
    {
      "id": "B-0003",
      "state": "RESOLVED",
      "condition": "Protect-main currently uses loose required status checks, so a previously green PR can remain mergeable after main changes; multi-agent source coordination is not complete until strict up-to-date enforcement is active.",
      "clears_when": "GITHUB_RULESET_22998982_STRICT_REQUIRED_STATUS_CHECKS_TRUE"
    }
  ],
  "last_observed": {
    "github": {
      "status": "VERIFIED",
      "observed_at": "2026-09-12T08:51:42Z",
      "repository_id": 1366835183,
      "full_name": "Vinanonymous/Build",
      "visibility": "public",
      "default_branch": "main",
      "head_sha": "daf1ba47bbba7bb836e7fba54a87bba29d6a01d1",
      "ruleset_count": 1,
      "ruleset_id": 22998982,
      "ruleset_name": "Protect-main",
      "ruleset_enforcement": "active",
      "ruleset_strict_required_status_checks": true,
      "open_pull_request_count": 0,
      "latest_continuity_workflow_run_id": 34683460385,
      "latest_continuity_workflow_conclusion": "success"
    },
    "supabase": {
      "status": "VERIFIED",
      "observed_at": "2026-09-12T08:51:42Z",
      "project_id": "jnenguxodtgwbskhdsxt",
      "project_status": "ACTIVE_HEALTHY",
      "region": "us-west-2",
      "organization_plan": "free",
      "public_table_count": 0,
      "edge_function_count": 0,
      "development_branch_count": 1,
      "migration_version": "20260912052949",
      "migration_name": "life_invocation_v1_alignment",
      "caller_table_count": 1,
      "invocation_table_count": 1,
      "record_invocation_v1_proc_count": 1,
      "runtime_role_count": 1,
      "caller_row_count": 0,
      "invocation_row_count": 0,
      "record_contract_alignment_status": "ALIGNED_VERIFIED",
      "missing_required_ledger_columns": [],
      "request_sha256_actual_type": "text",
      "request_sha256_required_type": "text",
      "legacy_rls_auto_enable_function_present": 0,
      "legacy_ensure_rls_event_trigger_present": 0,
      "security_advisor_lint_count": 0,
      "performance_advisor_lint_count": 0,
      "remote_alignment_mutation_provenance_status": "UNKNOWN",
      "remote_alignment_mutation_provenance_reason": "Migration 20260912052949 is present, but no machine-verifiable evidence identifies the original remote mutation as having held the required global Supabase production claim."
    },
    "vercel": {
      "status": "NOT_RUN",
      "observed_at": null,
      "target": null,
      "reason": "No exact Life Vercel infrastructure target is authorized."
    },
    "canonical_invocation": {
      "status": "NOT_RUN",
      "observed_at": "2026-09-12T08:51:42Z",
      "reason": "No exact Life Vercel target or deployed Life MCP endpoint is authorized-system verified and the exact tool life.invoke is not verified live."
    }
  },
  "next_action": {
    "id": "A-0008",
    "kind": "IMPLEMENT",
    "target": "BUILD_REPOSITORY_WATCHDOG",
    "description": "Reconcile the versioned watchdog source against the current source-coordination protocol, refresh its self-audit compatibility contract, pass protected CI, integrate it to main, and create the exact hourly America/Denver ChatGPT Scheduled task only if all pre-install gates pass.",
    "authorization_effect": "NONE"
  }
}
